{
  "schemaVersion": 1,
  "staleAfterMinutes": 180,
  "rules": {
    "lockKey": "workflowType:sourceId",
    "staleAction": "mark_for_review",
    "autoDeleteStale": false,
    "reuseExistingPullRequest": true
  },
  "locks": [
    {
      "lockKey": "weekly_planning:WEEK-2026-10-19",
      "jobId": "WEEKLY-PLANNING-WEEK-2026-10-19",
      "workflowType": "weekly_planning",
      "sourceId": "WEEK-2026-10-19",
      "acquiredAt": "2026-10-18T01:02:06+09:00",
      "heartbeatAt": "2026-10-18T01:08:43+09:00",
      "expiresAt": "2026-10-18T04:02:06+09:00",
      "state": "released",
      "branch": "planning/weekly-2026-10-19",
      "pullRequestUrl": "https://github.com/LifeifCreater/ai-video-business/pull/77",
      "reviewRequired": false
    },
    {
      "lockKey": "weekly_planning:WEEK-2026-10-26",
      "jobId": "WEEKLY-PLANNING-WEEK-2026-10-26",
      "workflowType": "weekly_planning",
      "sourceId": "WEEK-2026-10-26",
      "acquiredAt": "2026-10-25T01:00:07.342+09:00",
      "heartbeatAt": "2026-10-25T01:03:33+09:00",
      "expiresAt": "2026-10-25T04:00:07.342+09:00",
      "state": "released",
      "branch": "planning/weekly-2026-10-26",
      "pullRequestUrl": "https://github.com/LifeifCreater/ai-video-business/pull/78",
      "reviewRequired": false
    },
    {
      "lockKey": "weekly_planning:WEEK-2026-11-02",
      "jobId": "WEEKLY-PLANNING-WEEK-2026-11-02",
      "workflowType": "weekly_planning",
      "sourceId": "WEEK-2026-11-02",
      "acquiredAt": "2026-11-01T01:04:37+09:00",
      "heartbeatAt": "2026-11-01T01:08:15.542+09:00",
      "expiresAt": "2026-11-01T04:04:37+09:00",
      "state": "released",
      "branch": "planning/weekly-2026-11-02",
      "pullRequestUrl": "https://github.com/LifeifCreater/ai-video-business/pull/86",
      "reviewRequired": false
    }
  ]
}
